{
  "packet": "90bfec337ca227c9",
  "mode": "gather",
  "made": "2026-10-07",
  "owner": "shaun",
  "scope": "active",
  "cases": [
    {
      "case": "c1",
      "kind": "drift",
      "evidence": "T134: cites build.sh, but several tracked files have that name: give its path | T176: cites lib/Iapetus/Solver/Crossing.hs, which does not exist (moved? cite an anchor instead); cites Steer.hs, which does not exist (moved? cite an anchor instead) | T177: cites Solver/Flyby.hs, which does not exist (moved? cite an anchor instead); cites Maneuver/PoweredFlyby.hs, which does not exist (moved? cite an anchor instead) | T178: cites Maneuver/Shift.hs, which does not exist (moved? cite an anchor instead); cites Station.hs, which does not exist (moved? cite an anchor instead) | T220: cites summary.md, but several tracked files have that name: give its path",
      "allowed": [
        "flag",
        "link",
        "retag"
      ],
      "entries": [
        {
          "id": "T134",
          "kind": "T",
          "file": "todo.md",
          "title": "Ship concepts: do the class names go into the wiki?",
          "meta": {
            "priority": "P3",
            "added": "2026-09-29"
          },
          "body": "Longsight, Kestrel, Mule and Lantern, in `docs/archive/ship-concepts/`. What to commit was\nsettled in `49065c5`: the scripts, GLB models and hero renders, with the other formats\ngit-ignored and rebuilt by `build.sh`.",
          "hash": "b8940305a9e54716"
        },
        {
          "id": "T176",
          "kind": "T",
          "file": "todo.md",
          "title": "Port routes between a planet and its moons",
          "meta": {
            "priority": "P3",
            "added": "2026-09-30",
            "refs": "T175, Q114"
          },
          "body": "Only the legacy planner flew between a planet and its moons; it was deleted in T175. Read\nit at `412f938` (`lib/Iapetus/Solver/Crossing.hs`, `Plan.hs` `route`/`methodsFor`,\n`Steer.hs`) with [Half-Turn Transfers](../wiki/reference/Half-Turn%20Transfers.md).\nPort: the crossing into a child and the climb out of a moon into an orbit around its\nparent (`climbTo`); the half-turn doctrine (`heldPlane`, the injection fan at three\nquarters of the Hohmann time, `crossingFraction`), with `Lambert.planInPlane`, kept in\nthe kernel for it; the staging ellipse (`stagingRadii`); and the moon floors' aim\nallowance, `2·sphere/flight` (`Oberth.aimAllowance`, deleted). Acceptance, from the\nlegacy `test/Main.hs` at `412f938` (crossings L2474–2562, plan laws L2748–2995): LEO to\nLuna, injection under 4.5 km/s and the cheapest 3.5–5.5 km/s; Titan by way of Saturn,\nstaged in an ellipse, under 14.5 km/s, handing off at Earth, Saturn and Titan; the climb\nfrom Luna to ten Earth radii 1.4–1.6 km/s (the dearest under 1.8); Luna to Mars by way\nof Earth 6.5–8.0 km/s; every route real and valid.",
          "hash": "67aa535c3206ddc0"
        },
        {
          "id": "T177",
          "kind": "T",
          "file": "todo.md",
          "title": "Port multi-pass, powered and real-date flybys",
          "meta": {
            "priority": "P3",
            "added": "2026-09-30",
            "refs": "T175"
          },
          "body": "The planner's assist (`Strategies.viaAssist`) passes one body once; the legacy flyby solver\n(`Solver/Flyby.hs`, `Maneuver/PoweredFlyby.hs` at `412f938`, deleted in T175) also\npriced a powered pass and chained passes on real dates. Port them, reading\n[Voyager 2 Reference](../wiki/reference/Voyager%202%20Reference.md). Acceptance, from the\nlegacy `test/Main.hs` at `412f938` (L2380–2461): Voyager 2's Jupiter pass settles at both\nspheres with a periapsis of 640,000–750,000 km and a periapsis impulse under 100 m/s,\nhanding off at Earth and Jupiter; the grand tour's four legs (launch −8168.9 d, Jupiter\n−7480.56, Saturn −6702.36, Uranus −5089.75, Neptune −3781.34 d from J2000) fly as one\nreal, valid path, handing off at Earth, Jupiter, Saturn and Uranus, with 20–40 t of\npropellant left.",
          "hash": "9d1917e265fba309"
        },
        {
          "id": "T178",
          "kind": "T",
          "file": "todo.md",
          "title": "Port single-body orbit changes",
          "meta": {
            "priority": "P3",
            "added": "2026-09-30",
            "refs": "T175"
          },
          "body": "The planner reaches another body; only the legacy solvers changed an orbit around one\nbody (`Solver.hohmannTo`, `biEllipticTo`, `alignTo`; `Maneuver/Shift.hs` and\n`Station.hs` at `412f938`, deleted in T175). Port them as strategies for an objective at\nthe body the ship is at. Acceptance, from the legacy `test/Main.hs` at `412f938`: the\nsolver laws (L2093–2277), each shift arriving on its target circle or plane and pricing\nas its plan, and a chemical stage flying each as a real, valid path; Hohmann cheaper\nthan bi-elliptic from 7,000 to 14,000 km with a 100,000 km apex; the station descent at\nMars from its sphere to 20,428 km at 599.7 m/s over 2.48e6 s; the plane alignment\nburning at the planes' intersection within one period.",
          "hash": "ad74cf9543fd5ee3"
        },
        {
          "id": "T220",
          "kind": "T",
          "file": "todo.md",
          "title": "Strategy study: every HTN strategy in the literature, per compound task, ship class and band",
          "meta": {
            "priority": "P1",
            "added": "2026-10-01",
            "refs": "T216, T217, T218, T219, A178"
          },
          "body": "Shaun asked for a full, literature-backed list of the strategies the outer layer should have,\nfor every compound task (departure, capture, crossings, flybys, rendezvous, in-well changes,\nsurface, staging, waiting, aborts, tours, external momentum) against every band and ship class,\nthen to implement them slowly. The 22-strategy catalogue in `Flight Regimes.md` was written from\nmission practice and is checked against, not taken as the answer. Research only, no code, in\n`docs/strategy-study/` (brief in its README): seven reports, then `summary.md` with the matrix\nand the implementation order, then wiki rows and tasks. T216–T219 (capture) stand; the study may\nreorder them.\n\n*2026-10-01:* the seven reports and `summary.md` are written (about 120 strategies, prerequisites\nP1–P19, 14 waves, 11 open questions). Next, after Shaun reads it: the wiki rows, the corrections\nhe approves, and a task per wave.",
          "hash": "49e7c5a59dc87896"
        }
      ]
    },
    {
      "case": "c2",
      "kind": "drift",
      "evidence": "T175: cites test/Outer.hs, which does not exist (moved? cite an anchor instead); cites test/Planner.hs, which does not exist (moved? cite an anchor instead); cites test/Kernel.hs, which does not exist (moved? cite an anchor instead) | T149: cites docs/planning/, which does not exist (moved? cite an anchor instead) | T099: cites index.html, but several tracked files have that name: give its path; cites kit/shipkit.py, which does not exist (moved? cite an anchor instead); cites renders/lineup.png, which does not exist (moved? cite an anchor instead)",
      "allowed": [
        "flag",
        "link",
        "retag"
      ],
      "entries": [
        {
          "id": "T175",
          "kind": "T",
          "file": "done.md",
          "title": "Retire the legacy planner and rename Outer",
          "meta": {
            "done": "2026-09-30",
            "refs": "T123, T176, T177, T178, T157, LR011, LR014"
          },